{
  "$schema": "http://json-schema.org/draft-07/schema#",
  "$id": "https://github.com/TheArchitectit/AIGGP-Agentic-Framework/hub/schema/runners.schema.json",
  "title": "DevGate runner-monitor registry (instance state, never committed)",
  "type": "object",
  "additionalProperties": false,
  "required": ["version", "runners"],
  "properties": {
    "_comment": {
      "description": "Explanatory prose for a human reading the redacted example. Declared here because the example carries it and this schema closes itself to undeclared keys — an example that violates its own schema teaches the wrong shape.",
      "type": "array",
      "items": { "type": "string" }
    },
    "version": { "const": 1 },
    "token_salt": {
      "description": "Per-registry salt for heartbeat-token hashing (mon-sec-02). Generated on first use and persisted; heartbeat verifiers are stored only as salted hashes.",
      "type": "string"
    },
    "enrollment_tokens": {
      "description": "One-time enrollment tokens; consumed on successful /enroll.",
      "type": "array",
      "items": { "type": "string" }
    },
    "runners": {
      "type": "array",
      "items": { "$ref": "#/definitions/runner" }
    },
    "toolchain_requests": {
      "description": "Open and settled toolchain requests, one row per (lane, tool) (mon-tc-02). The hub is the system of record for these; Mission Control reads them and never stores a copy. Rows are keyed by lane and tool so a partial approval of a multi-tool profile is expressible (mon-tc-04). Absent for a registry written before this capability existed, which reads as an empty set — an empty set is 'nobody has asked for anything', never 'every lane is provisioned' (mon-tc-06).",
      "type": "array",
      "items": { "$ref": "#/definitions/toolchain_request" }
    },
    "toolchain_credentials": {
      "description": "Credentials the hub holds for deciding toolchain requests (mon-tc-03). Each entry stores the credential's class, identity, and scope, and ONLY a salted digest of the secret — never the secret itself, its prefix, or a derivation of it (mon-sec-02, applied to operator credentials as to heartbeat tokens). A class outside the closed table (enrollment, heartbeat, runner_key, operator, builder) is refused as `unknown`, so a new credential type cannot acquire a decision right by being unlisted. Absent for a registry written before this capability existed, which reads as an empty set — no operator credentials.",
      "type": "array",
      "items": { "$ref": "#/definitions/toolchain_credential" }
    },
    "toolchain_consumed_nonces": {
      "description": "Nonces the hub has already spent on a decision (mon-tc-03). A nonce is a random 256-bit string that identifies a decision moment rather than a principal, so storing it is not the mon-sec-02 problem heartbeat tokens are — but a consumed nonce is never echoed or logged, because publishing it would let a reader replay it against a row that has since moved. Absent for a registry written before this capability existed, which reads as an empty set — no nonces spent.",
      "type": "array",
      "items": { "type": "string" }
    }
  },
  "definitions": {
    "runner": {
      "type": "object",
      "required": ["name", "repo", "enrolled_at", "heartbeat_token_hash"],
      "properties": {
        "_comment": { "type": "array", "items": { "type": "string" } },
        "name": { "type": "string" },
        "repo": { "type": "string", "pattern": "^[A-Za-z0-9_.-]+/[A-Za-z0-9_.-]+$" },
        "labels": { "type": "array", "items": { "type": "string" } },
        "host_alias": { "type": "string" },
        "address": {
          "description": "The runner's routable (tailnet) address, published by the spoke at enroll and refreshed on every heartbeat. Service discovery resolves a service's host_alias against this; null until the spoke publishes one (mon-svcdisco-01).",
          "type": ["string", "null"]
        },
        "enrolled_at": { "type": "string", "format": "date-time" },
        "heartbeat_token_hash": {
          "description": "Salted sha256 of the heartbeat token — the plaintext token is never stored (mon-sec-02). Null after revocation.",
          "type": ["string", "null"],
          "pattern": "^sha256:[0-9a-f]{64}$"
        },
        "last_heartbeat": { "type": ["string", "null"], "format": "date-time" },
        "last_job_seen": { "type": ["string", "null"] },
        "disk_ok": { "type": ["boolean", "null"] },
        "podman_ok": { "type": ["boolean", "null"] },
        "image_digest": {
          "description": "The digest-qualified evaluator ref this host would gate with, or null when it cannot serve the pinned image (img-cycle-03). Null is UNKNOWN, never healthy.",
          "type": ["string", "null"]
        },
        "image_reason": {
          "description": "Why image_digest is null, in the host's own words. The vocabulary the shipped probe uses, one fault per fix: 'not provisioned: <vars> not set' | 'podman not on PATH' | 'store does not exist: <path>' | 'podman info failed for the configured store' | 'store mismatch: podman reports <a>, configured <b>' | 'pinned image absent from the store (not pulled)'. Free text from an untrusted-as-input host, so consumers must render it, never match on it.",
          "type": ["string", "null"]
        },
        "image_pin_divergence": {
          "description": "The host's report that the registry's served digest for the published tag no longer equals the recorded image_manifest_digest (img-cycle-05). Non-empty string names both digests ('served <image>:<tag> is <served> but the record is <record> — a re-pin is due'). Null means the host checked and they agree, OR it could not check — the two are deliberately the same value here because both mean 'no divergence was observed', and the check itself is a repository-reachable fact the publish job and the hub also carry. A key left out entirely means an older helper that does not report this field. Free text from an untrusted-as-input host, so consumers must render it, never match on it. Divergence is a fact about the repository, not a fault on the host (design D6): the tick still succeeds.",
          "type": ["string", "null"]
        },
        "scan_state": {
          "description": "The last fleet secret sweep this host reported (secret-scan-07), or null when it has no scan state to report. Null is UNKNOWN, never healthy: a host that has never been swept is not a swept-and-clean host. 'unreadable' is set when a report exists on the host and would not parse, and it is NOT an empty fleet.",
          "type": ["object", "null"],
          "properties": {
            "repos": {
              "description": "One record per declared repository. A repository the sweep could not fetch appears here with its state and reason rather than being omitted.",
              "type": "array",
              "items": {
                "type": "object",
                "required": ["name", "state"],
                "properties": {
                  "name": { "type": "string" },
                  "state": {
                    "description": "The sweep's own vocabulary: clean | findings | unfetchable | unscannable.",
                    "type": "string"
                  },
                  "reason": { "type": ["string", "null"] },
                  "scope": { "type": ["string", "null"] },
                  "scanned_at": { "type": ["string", "null"] },
                  "findings": { "type": "integer" },
                  "uncovered": { "type": "integer" }
                }
              }
            },
            "unreadable": {
              "description": "Why this host's report could not be read, or null when it was read. Free text from an untrusted-as-input host, so consumers must render it, never match on it.",
              "type": ["string", "null"]
            }
          }
        },
        "enrolled": { "type": "boolean", "default": true },
        "queue_threshold_min": { "type": "number" },
        "drift_period_min": { "type": "number" },
        "lane_image_ref": {
          "description": "The container reference this lane's runner image was built from (mon-tc-05). Separate from image_digest ON PURPOSE: image_digest is the coherence EVALUATOR ref and img-cycle-05 compares that tag's served digest; lane image identity is a different fact about a different image and conflating the two would join lane evidence to evaluator state. Null until a build job reports it. Free text from an untrusted-as-input host, so consumers must render it, never match on it.",
          "type": ["string", "null"]
        },
        "lane_image_digest": {
          "description": "Digest of the runner image this lane is actually running, reported by a build job and later confirmed by the lane's own heartbeat (mon-tc-05). Distinct from the evaluator image_digest above. Null means unreported, which is not 'the lane runs an unpinned image' and is never healthy.",
          "type": ["string", "null"]
        },
        "toolchain_profile_id": {
          "description": "The reviewed toolchain profile this lane is required to satisfy (mon-tc-01). Trusted input: a heartbeat can never set, widen, or rename it. Null means NO REVIEWED ASSIGNMENT — the lane requires nothing has been decided — which is a different answer from the profile named 'none', and the two must never render alike. An id outside the spec's profile table is refused rather than stored.",
          "type": ["string", "null"]
        },
        "coverage": {
          "description": "What this lane's last gap report was (mon-tc-06). Enumerates only the states a hub may STORE: 'reported' (a gap field arrived), 'never-reported' (a spoke that has not sent one since this capability shipped), 'probe-failed' (the last probe run was incomplete). 'stale' is deliberately NOT storable — it is derived from last_gap_report_at against TOOL_REQUEST_STALE_AFTER_S at read time, because a stored 'stale' becomes a lie the moment a heartbeat arrives that nobody has re-rendered. Absent reads as 'never-reported'; it is not evidence of a complete toolchain.",
          "type": ["string", "null"],
          "enum": ["reported", "never-reported", "probe-failed", null]
        },
        "last_gap_report_at": {
          "description": "When this lane last sent a missing_tools field, whether or not the list was empty (mon-tc-06). Drives the derived 'stale' coverage state. Null until the lane first reports a gap; absence is 'never-reported', never 'up to date'.",
          "type": ["string", "null"]
        },
        "toolchain_rejections": {
          "description": "Gap reports this lane submitted that were refused, counted by reason code (mon-tc-01: a rejection is 'recorded as a code and an incrementing counter'). The rejected VALUE is never stored, in any field, log line, or audit row — only which rule it broke and how often, so an operator can tell a typo-prone spoke from a hostile one without holding a copy of what it sent. Keys are fixed code strings; an empty array and an absent key both mean 'never rejected anything'.",
          "type": ["array", "null"],
          "items": {
            "type": "object",
            "required": ["code", "count"],
            "properties": {
              "code": { "type": "string" },
              "count": { "type": "integer", "minimum": 0 }
            }
          }
        }
      }
    },
    "toolchain_request": {
      "type": "object",
      "description": "One (lane, tool) toolchain request (mon-tc-02). additionalProperties is false on purpose: every field the code writes MUST be declared here, or the drift-guard (test_hub_registry_schema) cannot see a new field land. It was left open when this collection shipped, and `principal`/`last_reported_at` were written before either was declared — the exact silent drift the schema exists to catch, caught here only because a reviewer noticed the row never rejected the unknown.",
      "required": ["id", "lane", "tool", "state", "version"],
      "additionalProperties": false,
      "properties": {
        "_comment": { "type": "array", "items": { "type": "string" } },
        "id": {
          "description": "Stable row id (tcr-NNNN). The (lane, tool) pair is the identity that deduplicates reports (mon-tc-02); id exists so a decision can name the row it decided without the caller restating its key.",
          "type": "string"
        },
        "lane": { "description": "Hub runner_name (mon-tc-02). A lane Mission Control has not linked is reported as 'unmapped', never silently dropped.", "type": "string" },
        "tool": { "description": "One vocabulary member (mon-tc-01). Exact byte value, never normalized; 'g++' must survive storage, export and render unchanged.", "type": "string" },
        "required_profile": {
          "description": "The profile this row was opened against, recorded so a fulfilled request can name what it was fulfilled against after the profile changes (mon-tc-01). Trusted input, never spoke-supplied.",
          "type": ["string", "null"]
        },
        "state": { "enum": ["open", "approved", "built", "fulfilled", "denied"] },
        "version": { "description": "Compare-and-swap counter, incremented on every transition (mon-tc-04). A decision at an already-applied version returns that outcome instead of transitioning twice.", "type": "integer", "minimum": 1 },
        "observed_at": { "type": ["string", "null"] },
        "last_seen": { "description": "Advanced by every re-report of the same (lane, tool) gap; the row is NOT duplicated (mon-tc-02: a lane whose image never gains the tool re-reports every 300s).", "type": ["string", "null"] },
        "last_reported_at": { "description": "Last gap report for this pair, distinct from last_seen so a decision does not read as a fresh report. Advanced with last_seen on a re-report; a decision must NOT advance it.", "type": ["string", "null"] },
        "actor": { "description": "The operator's actor claim stored exactly as presented (mon-tc-03). v1 issues every decision from one credential, so a shared principal is the expected shape and must stay visible as such rather than being inferred into per-operator attribution.", "type": ["string", "null"] },
        "principal": { "description": "The deciding principal exactly as the credential presented it (mon-tc-03), mirrored from the latest audit record for readers who look at the row rather than the trail. Never a display name or email the hub did not receive.", "type": ["string", "null"] },
        "credential_id": { "type": ["string", "null"] },
        "decided_at": { "type": ["string", "null"] },
        "decision_note": { "description": "Operator's reason, capped at DECISION_NOTE_MAX_CHARS and refused rather than truncated. Rendered escaped; never reaches a builder input, a command, or a profile lookup (mon-tc-03, task 2.6).", "type": ["string", "null"], "maxLength": 512 },
        "nonces": { "description": "Consumed nonces, kept so a replay is refused rather than applied twice (mon-tc-03).", "type": "array", "items": { "type": "string" } },
        "build_id": { "type": ["string", "null"] },
        "builder_identity": { "description": "Which builder reported the evidence (mon-tc-05). Only a builder credential may supply it; a digest offered under an operator or runner credential is refused.", "type": ["string", "null"] },
        "lane_image_digest": { "description": "The built image digest this row is waiting for a lane to converge onto. Present with state 'built' does NOT mean fulfilled: convergence needs this digest AND a passing probe in a later heartbeat (mon-tc-05). Cleared to null when the lane reports a DIFFERENT digest, because that build will never converge and carrying a dead wait forward makes a permanent alarm.", "type": ["string", "null"] },
        "awaiting_cleared": { "description": "The lane-reported digest that already caused this row's awaited digest to be cleared (mon-tc-05). Exists so a lane that heartbeats an unmatched digest every 300s does not write an audit row every 300s: the clear is recorded once per digest, not once per tick. Not evidence of fulfillment — the row stays 'built' and visible (mon-tc-06) either way.", "type": ["string", "null"] },
        "fulfilled_at": { "type": ["string", "null"] },
        "suppression_until": { "description": "When a denial stops suppressing re-reports (mon-tc-04/mon-tc-06). Set on denial from TOOL_REQUEST_SUPPRESSION_DAYS; a report inside the window advances the suppression counter without changing state, a report after it reopens the row.", "type": ["string", "null"] },
        "suppressed_reports": { "description": "Re-reports swallowed while this row was denied (mon-tc-04 'no state change; suppression counter').", "type": "integer", "minimum": 0 },
        "history": {
          "description": "Append-only transition audit (mon-tc-04). One record per decision, refusal and transition, in the fixed shape mon-tc-03 defines; nothing rewrites or removes an entry, and transitions outside the normative table never reach it.",
          "type": "array",
          "items": {
            "type": "object",
            "additionalProperties": false,
            "required": ["seq", "at", "event"],
            "properties": {
              "seq": { "type": "integer", "minimum": 0 },
              "at": { "type": "string" },
              "actor": { "type": ["string", "null"] },
              "principal": { "type": ["string", "null"] },
              "credential_id": { "type": ["string", "null"] },
              "event": { "type": "string" },
              "from": { "type": ["string", "null"] },
              "to": { "type": ["string", "null"] },
              "version_before": { "type": ["integer", "null"] },
              "version_after": { "type": ["integer", "null"] },
              "note": { "type": ["string", "null"] }
            }
          }
        }
      }
    },
    "toolchain_credential": {
      "type": "object",
      "description": "One hub-held credential (mon-tc-03). The class is closed: enrollment, heartbeat, runner_key, operator, builder. Only the operator class may decide, and only when it carries scope `toolchain:decide`. A class outside the table is refused as `unknown`, so a new credential type cannot acquire a decision right by being unlisted.",
      "required": ["class", "credential_id"],
      "additionalProperties": false,
      "properties": {
        "_comment": { "type": "array", "items": { "type": "string" } },
        "class": {
          "description": "The credential's class, drawn from the closed table. Refused as `rejected_credential_class` when it is anything else.",
          "enum": ["enrollment", "heartbeat", "runner_key", "operator", "builder"]
        },
        "credential_id": { "type": "string" },
        "secret_hash": {
          "description": "Salted sha256 of the secret — the plaintext secret is never stored (mon-sec-02, applied to operator credentials as to heartbeat tokens). The hash carries no secret, its prefix, or a derivation of it.",
          "type": ["string", "null"],
          "pattern": "^sha256:[0-9a-f]{64}$"
        },
        "scope": {
          "description": "The scope this credential may exercise. Only `toolchain:decide` on an operator credential authorises a decision.",
          "type": ["string", "null"]
        },
        "principal": {
          "description": "The principal this credential presents, recorded exactly as the hub received it (mon-tc-03). Never a display name or email the hub did not receive.",
          "type": ["string", "null"]
        },
        "runner_name": { "type": ["string", "null"] },
        "builder_identity": { "type": ["string", "null"] }
      }
    }
  }
}
